{
  "$defs": {
    "step": {
      "additionalProperties": false,
      "description": "One tutorial step. TU-1 seeds only the round-1 steps; TU-6/TU-7 append round-2 steps without a schema change (the shape is fixed here, only content grows).",
      "properties": {
        "advance_on": {
          "description": "Event id (opaque string, game-agnostic) that advances past this step, e.g. 'tile_clicked:tutorial_flute'.",
          "minLength": 1,
          "type": "string"
        },
        "allow": {
          "description": "Input action ids allowed while this step is active (a whitelist; everything else is gated). Opaque strings, engine-agnostic.",
          "items": {
            "minLength": 1,
            "type": "string"
          },
          "type": "array"
        },
        "flags": {
          "additionalProperties": true,
          "description": "Free-form per-step data for the game-side director (D2). Deliberately open (additionalProperties: true) so later phases attach whatever they need with no schema bump.",
          "type": "object"
        },
        "highlight": {
          "description": "Opaque highlight target ids this step lights up (a tile marker, a construction card, a UI button), e.g. 'tile:tutorial_flute', 'card:musician', 'button:confirm'.",
          "items": {
            "minLength": 1,
            "type": "string"
          },
          "type": "array"
        },
        "id": {
          "description": "Stable step id, unique within the script.",
          "minLength": 1,
          "type": "string"
        },
        "message": {
          "description": "String id into the 'messages' object this step shows, or null for a step with no message box.",
          "oneOf": [
            {
              "type": "null"
            },
            {
              "minLength": 1,
              "type": "string"
            }
          ]
        }
      },
      "required": [
        "id",
        "message",
        "highlight",
        "advance_on",
        "allow",
        "flags"
      ],
      "type": "object"
    }
  },
  "$id": "tutorial.schema.json",
  "$schema": "https://json-schema.org/draft/2020-12/schema",
  "additionalProperties": false,
  "description": "The guided tutorial script (D3, planning/TutorialPLAN.md): step list, both message texts, and the two behavioral toggles. Read by engine/tutorial.py's generic step-sequencer (TU-6); this schema only fixes the data SHAPE so TU-6/TU-7 can extend the step list without a schema change. Humans edit only through the editor's Tutorial section; agents via write_validated.",
  "properties": {
    "first_loss_costs_life": {
      "description": "If true, the scripted first-round loss (no defences placed yet) costs a life like a normal loss; if false the first loss is free.",
      "type": "boolean"
    },
    "messages": {
      "additionalProperties": false,
      "description": "The two message-box texts the tutorial shows, keyed by id (closed set - the step structure is fixed, only these texts are editor-editable).",
      "properties": {
        "economy_intro": {
          "description": "First message box: explains economy buildings produce Love.",
          "minLength": 1,
          "type": "string"
        },
        "lives_intro": {
          "description": "Second message box: explains the 3 lives / destroyed-economy / defence buildings after the scripted first loss.",
          "minLength": 1,
          "type": "string"
        }
      },
      "required": [
        "economy_intro",
        "lives_intro"
      ],
      "type": "object"
    },
    "skippable": {
      "description": "If true, the first message box shows a Skip tutorial button.",
      "type": "boolean"
    },
    "steps": {
      "description": "The ordered step list.",
      "items": {
        "$ref": "#/$defs/step"
      },
      "minItems": 1,
      "type": "array"
    }
  },
  "required": [
    "skippable",
    "first_loss_costs_life",
    "messages",
    "steps"
  ],
  "title": "tutorial",
  "type": "object"
}
